{
  "data": {
    "id": "120711be-ccd7-4104-a12a-b14ef668a815",
    "otp": "123456",
    "type": "EMAIL",
    "value": "user@example.com"
  },
  "datacontenttype": "application/json",
  "dataschema": "https://notify.nhs.uk/events/schemas/ContactDetailVerificationRequested/v1.json",
  "dataschemaversion": "1.0.0",
  "id": "8681f3a6-3553-492f-aab1-25c86fade338",
  "plane": "data",
  "source": "//notify.nhs.uk/app/nhs-notify-template-management-prod/main",
  "specversion": "1.0",
  "subject": "120711be-ccd7-4104-a12a-b14ef668a815",
  "time": "2026-04-27T10:30:00.000Z",
  "type": "uk.nhs.notify.template-management.ContactDetailVerificationRequested.v1"
}
