{
  "data": {
    "id": "41e2303d-976e-4ad2-a2d6-442a1a26934e",
    "otp": "654321",
    "type": "SMS",
    "value": "+447890123456"
  },
  "datacontenttype": "application/json",
  "dataschema": "https://notify.nhs.uk/events/schemas/ContactDetailVerificationRequested/v1.json",
  "dataschemaversion": "1.0.0",
  "id": "ea03d606-3d6c-4720-bda4-5375e146eff2",
  "plane": "data",
  "source": "//notify.nhs.uk/app/nhs-notify-template-management-prod/main",
  "specversion": "1.0",
  "subject": "41e2303d-976e-4ad2-a2d6-442a1a26934e",
  "time": "2026-04-27T10:30:00.000Z",
  "type": "uk.nhs.notify.template-management.ContactDetailVerificationRequested.v1"
}
